{
  "schema_version": "3.0.0",
  "event_id": "event-1",
  "run_id": "run-1",
  "episode_id": "episode-1",
  "sequence_number": 0,
  "checkpoint": "episode.started",
  "event_type": "episode.started",
  "started_at": "2026-08-14T00:00:00+00:00",
  "ended_at": "2026-08-14T00:00:00+00:00",
  "attributes": {},
  "content_reference": null,
  "parent_event_id": null,
  "extensions": {}
}
